{
  "schemaVersion": "1.0",
  "id": "lutz-maths-demo",
  "version": 2,
  "title": "Vorrangregeln, Distributivgesetz und Potenzen",
  "subject": "maths",
  "chapter": "Vorrangregeln – Distributivgesetz – Potenzen",
  "grade": "Demo – Klassenstufe nicht festgelegt",
  "language": "de",
  "studentIds": ["lutz"],
  "isDemo": true,
  "sourceNotice": "48 künstliche, mathematisch geprüfte Entwicklungsaufgaben. Keine Schulunterlagen als Quelle; keine Aussage über den Lehrplan oder die Klassenstufe von Lutz. Vor regulärem Einsatz durch Aufgaben aus echten Unterrichtsquellen ersetzen.",
  "skills": [
    {
      "id": "math.order_operations",
      "name": "Vorrangregeln",
      "subject": "maths",
      "chapter": "Vorrangregeln – Distributivgesetz – Potenzen",
      "description": "Reihenfolge der Rechenarten in gemischten Termen beachten."
    },
    {
      "id": "math.parentheses",
      "name": "Klammern",
      "subject": "maths",
      "chapter": "Vorrangregeln – Distributivgesetz – Potenzen",
      "description": "Einfache und verschachtelte Klammern von innen nach außen berechnen."
    },
    {
      "id": "math.powers",
      "name": "Potenzen",
      "subject": "maths",
      "chapter": "Vorrangregeln – Distributivgesetz – Potenzen",
      "description": "Kleine ganzzahlige Potenzen berechnen und mit Vorrangregeln verbinden."
    },
    {
      "id": "math.distributivity",
      "name": "Distributivgesetz",
      "subject": "maths",
      "chapter": "Vorrangregeln – Distributivgesetz – Potenzen",
      "description": "Faktoren auf alle Klammerglieder verteilen und gleichartige Terme zusammenfassen."
    },
    {
      "id": "math.factorization",
      "name": "Ausklammern",
      "subject": "maths",
      "chapter": "Vorrangregeln – Distributivgesetz – Potenzen",
      "description": "Den größten gemeinsamen ganzzahligen Faktor aus einem Term ausklammern."
    },
    {
      "id": "math.word_problems",
      "name": "Sachaufgaben",
      "subject": "maths",
      "chapter": "Vorrangregeln – Distributivgesetz – Potenzen",
      "description": "Eine kurze Alltagssituation in einen passenden Rechenterm übersetzen."
    }
  ],
  "sourceRefs": [
    {
      "id": "synthetic_fixture_v1",
      "label": "Von Hand erstellte synthetische Entwicklungsaufgaben, Version 1",
      "kind": "fixture"
    },
    {
      "id": "synthetic_fixture_v2",
      "label": "Von Hand erstellte synthetische Erweiterungsaufgaben, Version 2",
      "kind": "fixture"
    }
  ],
  "durationMinutes": 30,
  "questionCount": 12,
  "questions": [
    {
      "id": "demo_math_001",
      "subject": "maths",
      "chapter": "Vorrangregeln – Distributivgesetz – Potenzen",
      "skillIds": ["math.order_operations"],
      "difficulty": 1,
      "points": 1,
      "questionType": "numeric",
      "question": "Berechne: 7 + 3 × 4",
      "instruction": "Gib nur das Ergebnis an. Dezimalkomma und Dezimalpunkt sind beide erlaubt.",
      "acceptedAnswers": ["19"],
      "correctAnswer": "19",
      "explanationSteps": ["Zuerst die Multiplikation: 3 × 4 = 12.", "Dann addieren: 7 + 12 = 19."],
      "hint": "Welche Rechenart hat Vorrang?",
      "secondHint": "Berechne zuerst 3 × 4.",
      "memoryRule": "Klammern zuerst, dann Potenzen, dann Punktrechnung, zuletzt Strichrechnung.",
      "commonMistake": "7 und 3 zuerst zu addieren würde die Vorrangregel verletzen.",
      "sourceRefs": ["synthetic_fixture_v1"],
      "estimatedSeconds": 75
    },
    {
      "id": "demo_math_002",
      "subject": "maths",
      "chapter": "Vorrangregeln – Distributivgesetz – Potenzen",
      "skillIds": ["math.order_operations"],
      "difficulty": 1,
      "points": 1,
      "questionType": "numeric",
      "question": "Berechne: (7 + 3) × 4",
      "instruction": "Gib nur das Ergebnis an. Dezimalkomma und Dezimalpunkt sind beide erlaubt.",
      "acceptedAnswers": ["40"],
      "correctAnswer": "40",
      "explanationSteps": ["Zuerst die Klammer: 7 + 3 = 10.", "Dann multiplizieren: 10 × 4 = 40."],
      "hint": "Beginne in der Klammer.",
      "secondHint": "Die Klammer ergibt 10. Multipliziere danach mit 4.",
      "memoryRule": "Klammern zuerst, dann Potenzen, dann Punktrechnung, zuletzt Strichrechnung.",
      "commonMistake": "Eine Klammer darf nicht ignoriert werden.",
      "sourceRefs": ["synthetic_fixture_v1"],
      "estimatedSeconds": 75
    },
    {
      "id": "demo_math_003",
      "subject": "maths",
      "chapter": "Vorrangregeln – Distributivgesetz – Potenzen",
      "skillIds": ["math.order_operations"],
      "difficulty": 1,
      "points": 1,
      "questionType": "numeric",
      "question": "Berechne: 24 ÷ 6 × 2",
      "instruction": "Gib nur das Ergebnis an. Dezimalkomma und Dezimalpunkt sind beide erlaubt.",
      "acceptedAnswers": ["8"],
      "correctAnswer": "8",
      "explanationSteps": [
        "Division und Multiplikation haben denselben Rang.",
        "Von links nach rechts: 24 ÷ 6 = 4.",
        "Dann 4 × 2 = 8."
      ],
      "hint": "Division und Multiplikation sind gleichrangig.",
      "secondHint": "Beginne links mit 24 ÷ 6.",
      "memoryRule": "Gleichrangige Rechenarten werden von links nach rechts ausgeführt.",
      "commonMistake": "6 × 2 zuerst zu rechnen würde eine zusätzliche Klammer erfinden.",
      "sourceRefs": ["synthetic_fixture_v1"],
      "estimatedSeconds": 75
    },
    {
      "id": "demo_math_004",
      "subject": "maths",
      "chapter": "Vorrangregeln – Distributivgesetz – Potenzen",
      "skillIds": ["math.order_operations"],
      "difficulty": 1,
      "points": 1,
      "questionType": "numeric",
      "question": "Berechne: 18 − 6 + 2",
      "instruction": "Gib nur das Ergebnis an. Dezimalkomma und Dezimalpunkt sind beide erlaubt.",
      "acceptedAnswers": ["14"],
      "correctAnswer": "14",
      "explanationSteps": [
        "Addition und Subtraktion haben denselben Rang.",
        "Von links nach rechts: 18 − 6 = 12.",
        "Dann 12 + 2 = 14."
      ],
      "hint": "Arbeite bei gleichrangigen Rechenarten von links nach rechts.",
      "secondHint": "Berechne zuerst 18 − 6.",
      "memoryRule": "Gleichrangige Rechenarten werden von links nach rechts ausgeführt.",
      "commonMistake": "6 + 2 darf nicht zuerst zusammengefasst werden.",
      "sourceRefs": ["synthetic_fixture_v1"],
      "estimatedSeconds": 75
    },
    {
      "id": "demo_math_005",
      "subject": "maths",
      "chapter": "Vorrangregeln – Distributivgesetz – Potenzen",
      "skillIds": ["math.order_operations", "math.powers"],
      "difficulty": 2,
      "points": 2,
      "questionType": "numeric",
      "question": "Berechne: 3 + 2 × (7 − 4)²",
      "instruction": "Gib nur das Ergebnis an. Dezimalkomma und Dezimalpunkt sind beide erlaubt.",
      "acceptedAnswers": ["21"],
      "correctAnswer": "21",
      "explanationSteps": [
        "Klammer: 7 − 4 = 3.",
        "Potenz: 3² = 9.",
        "Multiplikation: 2 × 9 = 18.",
        "Addition: 3 + 18 = 21."
      ],
      "hint": "Beginne mit der Klammer.",
      "secondHint": "Nach der Klammer steht 3 + 2 × 3². Berechne nun die Potenz.",
      "memoryRule": "Klammern zuerst, dann Potenzen, dann Punktrechnung, zuletzt Strichrechnung.",
      "commonMistake": "Die Potenz gilt für die ganze Klammer.",
      "sourceRefs": ["synthetic_fixture_v1"],
      "estimatedSeconds": 120
    },
    {
      "id": "demo_math_006",
      "subject": "maths",
      "chapter": "Vorrangregeln – Distributivgesetz – Potenzen",
      "skillIds": ["math.order_operations", "math.parentheses"],
      "difficulty": 2,
      "points": 2,
      "questionType": "numeric",
      "question": "Berechne: 48 ÷ (2 × (3 + 1))",
      "instruction": "Gib nur das Ergebnis an. Dezimalkomma und Dezimalpunkt sind beide erlaubt.",
      "acceptedAnswers": ["6"],
      "correctAnswer": "6",
      "explanationSteps": [
        "Innere Klammer: 3 + 1 = 4.",
        "Äußere Klammer: 2 × 4 = 8.",
        "Division: 48 ÷ 8 = 6."
      ],
      "hint": "Arbeite von der inneren zur äußeren Klammer.",
      "secondHint": "Berechne erst 3 + 1, dann multipliziere das Ergebnis mit 2.",
      "memoryRule": "Verschachtelte Klammern werden von innen nach außen berechnet.",
      "commonMistake": "48 ÷ 2 zuerst zu rechnen würde die äußere Klammer ignorieren.",
      "sourceRefs": ["synthetic_fixture_v1"],
      "estimatedSeconds": 120
    },
    {
      "id": "demo_math_007",
      "subject": "maths",
      "chapter": "Vorrangregeln – Distributivgesetz – Potenzen",
      "skillIds": ["math.powers"],
      "difficulty": 1,
      "points": 1,
      "questionType": "numeric",
      "question": "Berechne: 2³ + 3²",
      "instruction": "Gib nur das Ergebnis an. Dezimalkomma und Dezimalpunkt sind beide erlaubt.",
      "acceptedAnswers": ["17"],
      "correctAnswer": "17",
      "explanationSteps": ["2³ = 2 × 2 × 2 = 8.", "3² = 3 × 3 = 9.", "8 + 9 = 17."],
      "hint": "Eine Potenz ist eine wiederholte Multiplikation.",
      "secondHint": "2³ ergibt 8. Berechne dann 3².",
      "memoryRule": "aⁿ bedeutet: n gleiche Faktoren a miteinander multiplizieren.",
      "commonMistake": "2³ ist nicht 2 × 3.",
      "sourceRefs": ["synthetic_fixture_v1"],
      "estimatedSeconds": 75
    },
    {
      "id": "demo_math_008",
      "subject": "maths",
      "chapter": "Vorrangregeln – Distributivgesetz – Potenzen",
      "skillIds": ["math.order_operations", "math.powers"],
      "difficulty": 2,
      "points": 2,
      "questionType": "numeric",
      "question": "Berechne: (2 + 3)² − 4 × 3",
      "instruction": "Gib nur das Ergebnis an. Dezimalkomma und Dezimalpunkt sind beide erlaubt.",
      "acceptedAnswers": ["13"],
      "correctAnswer": "13",
      "explanationSteps": [
        "Klammer: 2 + 3 = 5.",
        "Potenz: 5² = 25.",
        "Multiplikation: 4 × 3 = 12.",
        "Subtraktion: 25 − 12 = 13."
      ],
      "hint": "Berechne die Klammer vor der Potenz.",